"DESCRIPTION","DURATION IN MS","NAME","PARENT SUITE","START TIME","STATUS","STOP TIME","SUB SUITE","SUITE","TEST CLASS","TEST METHOD"
"","6554","checking that Footer Links will redirect to the correct pages","home page actions","Mon Mar 24 09:14:05 EET 2025","passed","Mon Mar 24 09:14:12 EET 2025","","","",""
"","2157","check that selecting a menu option without a dropdown redirects the user to the new page","home page actions","Mon Mar 24 09:13:27 EET 2025","passed","Mon Mar 24 09:13:29 EET 2025","","","",""
"","18891","checking the opening of the main page","home page actions","Mon Mar 24 09:13:03 EET 2025","passed","Mon Mar 24 09:13:22 EET 2025","","","",""
"","7282","checking the search function","shop page actions","Mon Mar 24 09:14:20 EET 2025","passed","Mon Mar 24 09:14:27 EET 2025","","","",""
"","5352","verify that clicking on a menu option with a dropdown correctly displays a list of available sub-options","home page actions","Mon Mar 24 09:13:22 EET 2025","passed","Mon Mar 24 09:13:27 EET 2025","","","",""
"","631","check that user navigate to a different domain page when clicking Shop","home page actions","Mon Mar 24 09:14:04 EET 2025","passed","Mon Mar 24 09:14:05 EET 2025","","","",""
"","5315","check that Download pricing is performed successfully","home page actions","Mon Mar 24 09:13:59 EET 2025","passed","Mon Mar 24 09:14:04 EET 2025","","","",""
"","10223","checking that the contact form is sent successfully when all required fields are filled in","home page actions","Mon Mar 24 09:13:40 EET 2025","passed","Mon Mar 24 09:13:50 EET 2025","","","",""
"","2025","checking that user has the ability to add a product to the cart","shop page actions","Mon Mar 24 09:14:27 EET 2025","passed","Mon Mar 24 09:14:29 EET 2025","","","",""
